{
  "run_id": "github-discovery-38347339062",
  "task_type": "GITHUB_DISCOVERY",
  "status": "COMPLETED",
  "started_at": "2026-10-13T04:37:43.080555+00:00",
  "completed_at": "2026-10-13T04:37:43.080555+00:00",
  "input_refs": [
    ".github/workflows/noema-discovery.yml"
  ],
  "artifact_digests": {
    "noema-crossref-candidates": "sha256:d1d89d62488d57a6040c7ad984118509e5fdbaf97d01c80b93676891b20e35b3"
  },
  "sources_examined": 0,
  "new_candidates": 126,
  "candidate_updates": 0,
  "contradictions": 0,
  "dating_revisions": 0,
  "relationships_generated": 0,
  "hypotheses_revisited": 0,
  "hypotheses_promoted": 0,
  "confidence_or_scope_changes": 0,
  "review_items_created": 30,
  "errors": [],
  "summary": "Crossref discovery produced 126 unreviewed candidates and 30 priority items.",
  "code_commit": "bedc99994309b2c1883db4765fb6912879c5ebbd",
  "epistemic_guards": {
    "model_output_is_evidence": false,
    "unknown_is_absent": false,
    "similarity_implies_descent": false,
    "automatic_claim_promotion": false
  }
}
