{
  "run_id": "museum-media-40649807315",
  "task_type": "MUSEUM_MEDIA_DISCOVERY",
  "status": "COMPLETED_REFERENCE_ONLY",
  "started_at": "2026-10-28T07:24:15.177209+00:00",
  "completed_at": "2026-10-28T07:24:15.177209+00:00",
  "input_refs": [
    "Art Institute of Chicago Open Access API",
    "Cleveland Museum of Art Open Access API",
    "projects/noema/data/reference/belief-catalog-v1.json"
  ],
  "artifact_digests": {
    "museum-reference-media": "sha256:21667ff9a947b1ad3ddbd73a101152bc4dd7ce1d4607989c66509806f66322f3"
  },
  "sources_examined": 22,
  "new_candidates": 15,
  "candidate_updates": 0,
  "contradictions": 0,
  "dating_revisions": 0,
  "relationships_generated": 0,
  "hypotheses_revisited": 0,
  "hypotheses_promoted": 0,
  "confidence_or_scope_changes": 0,
  "review_items_created": 0,
  "errors": [],
  "summary": "Published 15 provider-asserted public-domain museum reference images. These remain non-evidentiary visual context.",
  "code_commit": "d30f0dc8b1b439dcce5bbb423dd851c6c3a2fab9",
  "epistemic_guards": {
    "model_output_is_evidence": false,
    "unknown_is_absent": false,
    "similarity_implies_descent": false,
    "automatic_claim_promotion": false
  }
}
