{
  "run_id": "chatgpt-daily-2026-08-31",
  "task_type": "DAILY_INGEST",
  "status": "COMPLETED",
  "started_at": "2026-08-31T06:42:31Z",
  "completed_at": "2026-08-31T06:46:13Z",
  "input_refs": [
    "projects/noema/data/runs/github-discovery-33361678545.json",
    ".github/workflows/noema-discovery.yml",
    "projects/noema/schemas/run-manifest-v1.json",
    "projects/noema/data/candidates/discovery-triage-2026-08-29.json",
    "projects/noema/data/candidates/daily/2026-08-31.json",
    "https://dergipark.org.tr/en/pub/anemon/article/1853088",
    "https://sis.gov.eg/en/media-center/news/old-kingdom-tomb-discovered-at-egypt-s-saqqara-necropolis/",
    "https://superstitionsmap.com/dataset/",
    "https://superstitionsmap.com/data-license/",
    "https://doi.org/10.46222/pharosjot.107.223"
  ],
  "artifact_digests": {
    "noema-crossref-candidates-json": "sha256:c5a03866e15f372adf57611862bf424852c5d4be1b3d846744abcc8eff342a77",
    "noema-crossref-candidates-artifact-bundle": "sha256:900cbbfdca976a65847529c8a2563b708126281ce150b917f73378088fb7bdc0"
  },
  "sources_examined": 14,
  "new_candidates": 4,
  "candidate_updates": 0,
  "contradictions": 2,
  "dating_revisions": 0,
  "relationships_generated": 0,
  "hypotheses_revisited": 4,
  "hypotheses_promoted": 0,
  "confidence_or_scope_changes": 0,
  "review_items_created": 4,
  "errors": [],
  "summary": "Verified the latest successful NOEMA Discovery artifact: 121 unreviewed Crossref candidates with a 30-item priority queue (2 RECENT_PUBLICATION, 1 UPCOMING_OR_AHEAD_OF_PRINT, 27 NEWLY_INDEXED_LEGACY). After DOI/canonical-URL deduplication against prior triage, persisted four material candidates: a 30 Aug 2026 Kura-Araxes/Trialeti publication, the authoritative Sekhentyu-Ptah Saqqara field discovery, SuperstitionsMap v1.0.1 as a structured discovery dataset with prevalence/stereotyping guards, and a culturally scoped 2026 Turkic/Kazakh shamanism-ASC synthesis. No verified dating revision and no automatic evidence or claim promotion occurred.",
  "research_note": "projects/noema/data/candidates/daily/2026-08-31.json",
  "code_commit": "203e3164ea512f87373f5ec75e9a3366e03b44eb",
  "epistemic_guards": {
    "model_output_is_evidence": false,
    "unknown_is_absent": false,
    "similarity_implies_descent": false,
    "automatic_claim_promotion": false
  }
}
