{
  "run_id": "chatgpt-daily-2026-09-10",
  "task_type": "DAILY_INGEST",
  "status": "COMPLETED",
  "started_at": "2026-09-10T06:08:08Z",
  "completed_at": "2026-09-10T06:14:30Z",
  "input_refs": [
    "github:joaoccaldas/ai/actions/runs/34437325927",
    "github-artifact:10136643442:noema-crossref-candidates",
    "projects/noema/data/runs/github-discovery-34437325927.json",
    "projects/noema/data/candidates/daily/2026-09-09.json",
    "projects/noema/schemas/run-manifest-v1.json",
    "Consensus scholarly index",
    "web:Science Advances DOI 10.1126/sciadv.aei1901",
    "web:Nature DOI 10.1038/s41586-026-10976-9",
    "web:Nature DOI 10.1038/s41586-026-10997-4",
    "web:Frontiers in Psychology DOI 10.3389/fpsyg.2026.1689818",
    "web:Cognitive Science DOI 10.1111/cogs.70158"
  ],
  "artifact_digests": {
    "noema-crossref-candidates-raw-json": "sha256:160c7ffcfcde6b68dcee4ae60708eff9a8e874760997c7b071a50add875eb60e",
    "noema-crossref-candidates-github-zip": "sha256:d00160d69318ffb86830be664d59941a592fda80e9c495c9290e150b0bc76437",
    "daily-candidate-triage-commit": "4d90efc0f7c0766d842b1723f356ef6a1fbb56d3"
  },
  "sources_examined": 18,
  "new_candidates": 5,
  "candidate_updates": 4,
  "contradictions": 5,
  "dating_revisions": 1,
  "relationships_generated": 0,
  "hypotheses_revisited": 6,
  "hypotheses_promoted": 0,
  "confidence_or_scope_changes": 0,
  "review_items_created": 6,
  "errors": [],
  "summary": "Binary-verified NOEMA Discovery artifact contained 105 unreviewed candidates and a 30-item priority queue: 6 RECENT_PUBLICATION, 2 UPCOMING_OR_AHEAD_OF_PRINT and 22 NEWLY_INDEXED_LEGACY. Fresh scholarly/public screening added five deduplicated candidate-only records: Late Pleistocene habitual betel-nut use in Sulawesi; two complementary Bianfu Cave Denisovan Nature papers; a modern autism/schizotypy-religiosity study; and a structured historical corpus of more than 2,000 texts on ghost belief and secular critique in early twentieth-century China. One candidate chronology revision was created for psychoactive-plant use. No descent/diffusion relationships, evidence promotions, hypothesis promotions or confidence changes were made.",
  "research_note": "Highest-priority human review: Sulawesi betel-nut chronology and the Bianfu Denisovan pair. Preserve strict separation between psychoactive exposure and ritual meaning; molecular taxonomic attribution and artifact authorship; modern neurocognitive trait associations and retrospective diagnosis; and public historical rhetoric versus private belief or population prevalence.",
  "code_commit": "8873869ffa19b5031fec55ca323522394e2c73bb",
  "epistemic_guards": {
    "model_output_is_evidence": false,
    "unknown_is_absent": false,
    "similarity_implies_descent": false,
    "automatic_claim_promotion": false,
    "historical_diagnosis_from_resemblance": false
  }
}
