{
  "run_id": "chatgpt-daily-2026-09-04",
  "task_type": "DAILY_INGEST",
  "status": "COMPLETED_CANDIDATES_PERSISTED",
  "started_at": "2026-09-04T06:51:32Z",
  "completed_at": "2026-09-04T06:57:00Z",
  "input_refs": [
    "github-discovery-33836960441",
    "GitHub Actions artifact 9923591885",
    "projects/noema/data/candidates/pubmed-latest.json",
    "projects/noema/data/candidates/daily/2026-09-03.json",
    "Consensus scholarly index",
    "PubMed / NCBI",
    "fresh public web research"
  ],
  "artifact_digests": {
    "source_noema_crossref_payload": "sha256:e5c8b8b9c8433dc9c944d21d26ca8f1cad2c81e96acf2ec42fb12e1083bb6a9c",
    "source_github_actions_zip": "sha256:92487b95f88268061c95ea355a29c4880cd93260052796b6011320b4c7b65d94",
    "source_pubmed_latest": "sha256:b8401172964c36d471fc4054324bc5e9cef7ff2b6f3e2613899cb96af4f46e54",
    "daily_candidate_triage": "sha256:1fd17179caa56cfe94358810e973910d0c8037d9b266e763ad232800f26ad729"
  },
  "sources_examined": 14,
  "new_candidates": 5,
  "candidate_updates": 4,
  "contradictions": 7,
  "dating_revisions": 0,
  "relationships_generated": 0,
  "hypotheses_revisited": 8,
  "hypotheses_promoted": 0,
  "confidence_or_scope_changes": 0,
  "review_items_created": 8,
  "errors": [],
  "summary": "Verified NOEMA Discovery run 33836960441: 115 candidates and a 30-item priority queue (6 RECENT_PUBLICATION, 1 UPCOMING_OR_AHEAD_OF_PRINT, 23 NEWLY_INDEXED_LEGACY). Staged five deduplicated candidate-only additions covering magic/predictive processing, supernatural-concept memorability, magical-thinking psychopathology guardrails, belief-versus-practice ontology, and the Żórawina mortuary field discovery; triaged the new 114-society moralistic-supernatural paper and current neurotheology PubMed review as updates. No evidence, relationship, diagnosis, or dating revision was promoted.",
  "research_note": "projects/noema/data/candidates/daily/2026-09-04.json",
  "code_commit": "de320feafc04f9a7c1479621652e6e5a93b15153",
  "epistemic_guards": {
    "model_output_is_evidence": false,
    "unknown_is_absent": false,
    "similarity_implies_descent": false,
    "automatic_claim_promotion": false,
    "historical_diagnosis_from_resemblance": false
  }
}